;Tweet;Sentimen;step01;tokens;tokens_perbaikan;Stop_removal;step02;ProcessedText
452;Klo ngikutin twitnya di elisa..dia pernah loh iseng ngitung selisih antara data pemprov sama gugus covid..hasilnya pemrov yg meninggal 144 gugus covid 114.. Ya Allah kebayang sebenarnya bagaimana..;0.0;klo ngikutin twitnya di elisa repeated dia pernah loh iseng ngitung selisih antara data pemprov sama gugus covid repeated hasilnya pemrov yg meninggal number gugus covid number repeated ya allah kebayang sebenarnya bagaimana repeated;['klo', 'ngikutin', 'twitnya', 'di', 'elisa', 'repeated', 'dia', 'pernah', 'loh', 'iseng', 'ngitung', 'selisih', 'antara', 'data', 'pemprov', 'sama', 'gugus', 'covid', 'repeated', 'hasilnya', 'pemrov', 'yg', 'meninggal', 'number', 'gugus', 'covid', 'number', 'repeated', 'ya', 'allah', 'kebayang', 'sebenarnya', 'bagaimana', 'repeated'];['kalau', 'ngikutin', 'twitnya', 'di', 'elisa', 'repeated', 'dia', 'pernah', 'loh', 'iseng', 'ngitung', 'selisih', 'antara', 'data', 'pemprov', 'sama', 'gugus', 'covid', 'repeated', 'hasilnya', 'pemrov', 'yang', 'meninggal', 'number', 'gugus', 'covid', 'number', 'repeated', 'iya', 'allah', 'kebayang', 'sebenarnya', 'bagaimana', 'repeated'];['ngikutin', 'twitnya', 'elisa', 'repeated', 'loh', 'iseng', 'ngitung', 'selisih', 'data', 'pemprov', 'gugus', 'covid', 'repeated', 'hasilnya', 'pemrov', 'meninggal', 'number', 'gugus', 'covid', 'number', 'repeated', 'iya', 'allah', 'kebayang', 'repeated'];ngikutin twitnya elisa repeated loh iseng ngitung selisih data pemprov gugus covid repeated hasilnya pemrov meninggal number gugus covid number repeated iya allah kebayang repeated;ngikutin twitnya elisa repeated loh iseng ngitung selisih data pemprov gugus covid repeated hasil pemrov tinggal number gugus covid number repeated iya allah bayang repeated
453;Kirain PSPB ternyata PSBB, udah mikir covid dilawan pake pelajaran sejarah aja;0.0;kirain allcaps pspb allcaps ternyata allcaps psbb allcaps udah mikir covid dilawan pake pelajaran sejarah aja;['kirain', 'allcaps', 'pspb', 'allcaps', 'ternyata', 'allcaps', 'psbb', 'allcaps', 'udah', 'mikir', 'covid', 'dilawan', 'pake', 'pelajaran', 'sejarah', 'aja'];['prasangka', 'allcaps', 'pspb', 'allcaps', 'ternyata', 'allcaps', 'psbb', 'allcaps', 'sudah', 'mikir', 'covid', 'dilawan', 'pakai', 'pelajaran', 'sejarah', 'saja'];['prasangka', 'allcaps', 'pspb', 'allcaps', 'allcaps', 'psbb', 'allcaps', 'mikir', 'covid', 'dilawan', 'pakai', 'pelajaran', 'sejarah'];prasangka allcaps pspb allcaps allcaps psbb allcaps mikir covid dilawan pakai pelajaran sejarah;prasangka allcaps pspb allcaps allcaps psbb allcaps mikir covid lawan pakai ajar sejarah
454;Putus Penyebaran Covid-19. Polsek Jatikalen memberikan Himbuan kepada warga masyarakat untuk lindungi diri sendiri dan keluarga dengan berada di rumah sajaTidak Mudik, Tidak Piknik dan Tidak Panik;1.0;putus penyebaran covid number polsek jatikalen memberikan himbuan kepada warga masyarakat untuk lindungi diri sendiri dan keluarga dengan berada di rumah sajatidak mudik tidak piknik dan tidak panik;['putus', 'penyebaran', 'covid', 'number', 'polsek', 'jatikalen', 'memberikan', 'himbuan', 'kepada', 'warga', 'masyarakat', 'untuk', 'lindungi', 'diri', 'sendiri', 'dan', 'keluarga', 'dengan', 'berada', 'di', 'rumah', 'sajatidak', 'mudik', 'tidak', 'piknik', 'dan', 'tidak', 'panik'];['putus', 'penyebaran', 'covid', 'number', 'polsek', 'jatikalen', 'memberikan', 'himbuan', 'kepada', 'warga', 'masyarakat', 'untuk', 'lindungi', 'diri', 'sendiri', 'dan', 'keluarga', 'dengan', 'berada', 'di', 'rumah', 'sajatidak', 'mudik', 'tidak', 'piknik', 'dan', 'tidak', 'panik'];['putus', 'penyebaran', 'covid', 'number', 'polsek', 'jatikalen', 'himbuan', 'warga', 'masyarakat', 'lindungi', 'keluarga', 'rumah', 'sajatidak', 'mudik', 'piknik', 'panik'];putus penyebaran covid number polsek jatikalen himbuan warga masyarakat lindungi keluarga rumah sajatidak mudik piknik panik;putus sebar covid number polsek jatikalen himbuan warga masyarakat lindung keluarga rumah sajatidak mudik piknik panik
455;"Yaa Allaah,Bimbinglah kami dengan CahayaMU menujuMU, dan jadikanlah kami Berdiri tegak dalam penghambaan sejati di hadapanMU.Yaa Robb,Lindungi &amp; selamatkanlah kami dari Akhlah tercela& tipu daya Nafsu yg hina &amp; tercela.Smg Covid-19 ini segera Engkau angkat dr negeri ini.";1.0;yaa allaah bimbinglah kami dengan cahayamu menujumu dan jadikanlah kami berdiri tegak dalam penghambaan sejati di hadapanmu yaa robb lindungi selamatkanlah kami dari akhlah tercela tipu daya nafsu yg hina tercela smg covid number ini segera engkau angkat dr negeri ini;['yaa', 'allaah', 'bimbinglah', 'kami', 'dengan', 'cahayamu', 'menujumu', 'dan', 'jadikanlah', 'kami', 'berdiri', 'tegak', 'dalam', 'penghambaan', 'sejati', 'di', 'hadapanmu', 'yaa', 'robb', 'lindungi', 'selamatkanlah', 'kami', 'dari', 'akhlah', 'tercela', 'tipu', 'daya', 'nafsu', 'yg', 'hina', 'tercela', 'smg', 'covid', 'number', 'ini', 'segera', 'engkau', 'angkat', 'dr', 'negeri', 'ini'];['iya', 'allaah', 'bimbinglah', 'kami', 'dengan', 'cahayamu', 'menujumu', 'dan', 'jadikanlah', 'kami', 'berdiri', 'tegak', 'dalam', 'penghambaan', 'sejati', 'di', 'hadapanmu', 'iya', 'robb', 'lindungi', 'selamatkanlah', 'kami', 'dari', 'akhlah', 'tercela', 'tipu', 'daya', 'nafsu', 'yang', 'hina', 'tercela', 'semoga', 'covid', 'number', 'ini', 'segera', 'engkau', 'angkat', 'dari', 'negeri', 'ini'];['iya', 'allaah', 'bimbinglah', 'cahayamu', 'menujumu', 'jadikanlah', 'berdiri', 'tegak', 'penghambaan', 'sejati', 'hadapanmu', 'iya', 'robb', 'lindungi', 'selamatkanlah', 'akhlah', 'tercela', 'tipu', 'daya', 'nafsu', 'hina', 'tercela', 'semoga', 'covid', 'number', 'engkau', 'angkat', 'negeri'];iya allaah bimbinglah cahayamu menujumu jadikanlah berdiri tegak penghambaan sejati hadapanmu iya robb lindungi selamatkanlah akhlah tercela tipu daya nafsu hina tercela semoga covid number engkau angkat negeri;iya allaah bimbing cahaya tuju jadi diri tegak hamba sejati hadap iya robb lindung selamat akh cela tipu daya nafsu hina cela moga covid number engkau angkat negeri
456;Semoga virus covid 19 musnah dr negri ini amin;1.0;semoga virus covid number musnah dr negri ini amin;['semoga', 'virus', 'covid', 'number', 'musnah', 'dr', 'negri', 'ini', 'amin'];['semoga', 'virus', 'covid', 'number', 'musnah', 'dari', 'negri', 'ini', 'semoga'];['semoga', 'virus', 'covid', 'number', 'musnah', 'negri', 'semoga'];semoga virus covid number musnah negri semoga;moga virus covid number musnah negri moga
457;Upaya pencegahan penyebaran virus Corona atau Covid-19 kembali dilakukan oleh Bandar Udara Internasional Sultan Aji Muhammad Sulaiman (SAMS) Sepinggan Balikpapan.Berita selengkapnya kunjungi;1.0;upaya pencegahan penyebaran virus corona atau covid number kembali dilakukan oleh bandar udara internasional sultan aji muhammad sulaiman allcaps sams allcaps sepinggan balikpapan berita selengkapnya kunjungi;['upaya', 'pencegahan', 'penyebaran', 'virus', 'corona', 'atau', 'covid', 'number', 'kembali', 'dilakukan', 'oleh', 'bandar', 'udara', 'internasional', 'sultan', 'aji', 'muhammad', 'sulaiman', 'allcaps', 'sams', 'allcaps', 'sepinggan', 'balikpapan', 'berita', 'selengkapnya', 'kunjungi'];['upaya', 'pencegahan', 'penyebaran', 'virus', 'corona', 'atau', 'covid', 'number', 'kembali', 'dilakukan', 'oleh', 'bandar', 'udara', 'internasional', 'sultan', 'aji', 'muhammad', 'sulaiman', 'allcaps', 'sams', 'allcaps', 'sepinggan', 'balikpapan', 'berita', 'selengkapnya', 'kunjungi'];['upaya', 'pencegahan', 'penyebaran', 'virus', 'corona', 'covid', 'number', 'bandar', 'udara', 'internasional', 'sultan', 'aji', 'muhammad', 'sulaiman', 'allcaps', 'sams', 'allcaps', 'sepinggan', 'balikpapan', 'berita', 'selengkapnya', 'kunjungi'];upaya pencegahan penyebaran virus corona covid number bandar udara internasional sultan aji muhammad sulaiman allcaps sams allcaps sepinggan balikpapan berita selengkapnya kunjungi;upaya cegah sebar virus corona covid number bandar udara internasional sultan aji muhammad sulaiman allcaps sams allcaps pinggan balikpapan berita lengkap kunjung
458;Jumat Agung , selmat Ibadah di rumah masing2 tanpa mengurangi maknanya,semoga wabah covid-19 cepat selesai. amin;1.0;jumat agung selmat ibadah di rumah masing2 tanpa mengurangi maknanya semoga wabah covid number cepat selesai amin;['jumat', 'agung', 'selmat', 'ibadah', 'di', 'rumah', 'masing2', 'tanpa', 'mengurangi', 'maknanya', 'semoga', 'wabah', 'covid', 'number', 'cepat', 'selesai', 'amin'];['jumat', 'agung', 'selmat', 'ibadah', 'di', 'rumah', 'masing2', 'tanpa', 'mengurangi', 'maknanya', 'semoga', 'wabah', 'covid', 'number', 'cepat', 'selesai', 'semoga'];['jumat', 'agung', 'selmat', 'ibadah', 'rumah', 'masing2', 'mengurangi', 'maknanya', 'semoga', 'wabah', 'covid', 'number', 'cepat', 'selesai', 'semoga'];jumat agung selmat ibadah rumah masing2 mengurangi maknanya semoga wabah covid number cepat selesai semoga;jumat agung selmat ibadah rumah masing2 kurang makna moga wabah covid number cepat selesai moga
459;Cegah covid-19 beserta jajaran Polsek Kuranji melakukan aksi peduli berupa pembagian masker gratis bagi pengguna jalan kegiatan ini dilakukan di depan Polsek Kuranji.Kamis (9/4) Febriputraguci;1.0;cegah covid number beserta jajaran polsek kuranji melakukan aksi peduli berupa pembagian masker gratis bagi pengguna jalan kegiatan ini dilakukan di depan polsek kuranji kamis number number febriputraguci;['cegah', 'covid', 'number', 'beserta', 'jajaran', 'polsek', 'kuranji', 'melakukan', 'aksi', 'peduli', 'berupa', 'pembagian', 'masker', 'gratis', 'bagi', 'pengguna', 'jalan', 'kegiatan', 'ini', 'dilakukan', 'di', 'depan', 'polsek', 'kuranji', 'kamis', 'number', 'number', 'febriputraguci'];['cegah', 'covid', 'number', 'beserta', 'jajaran', 'polsek', 'kuranji', 'melakukan', 'aksi', 'peduli', 'berupa', 'pembagian', 'masker', 'gratis', 'bagi', 'pengguna', 'jalan', 'kegiatan', 'ini', 'dilakukan', 'di', 'depan', 'polsek', 'kuranji', 'kamis', 'number', 'number', 'febriputraguci'];['cegah', 'covid', 'number', 'beserta', 'jajaran', 'polsek', 'kuranji', 'aksi', 'peduli', 'pembagian', 'masker', 'gratis', 'pengguna', 'jalan', 'kegiatan', 'polsek', 'kuranji', 'kamis', 'number', 'number', 'febriputraguci'];cegah covid number beserta jajaran polsek kuranji aksi peduli pembagian masker gratis pengguna jalan kegiatan polsek kuranji kamis number number febriputraguci;cegah covid number serta jajar polsek ranji aksi peduli bagi masker gratis guna jalan giat polsek ranji kamis number number febriputraguci
460;pagi... kenapa ya di daerah sy (cipinang besar selatan) rt 7 rw 6 nya tdk prnh aware dgn warganya. Setiap ada bantuan tidak pernah transparansi & kejadian covid ini jg tidak ada tindakan semprot disinfektan, dbd jg banyak tp tidak ada fogging. Tp uang kas ttp jalan;0.0;pagi repeated kenapa ya di daerah sy cipinang besar selatan rt number rw number nya tdk prnh aware dgn warganya setiap ada bantuan tidak pernah transparansi kejadian covid ini jg tidak ada tindakan semprot disinfektan dbd jg banyak tp tidak ada fogging tp uang kas ttp jalan;['pagi', 'repeated', 'kenapa', 'ya', 'di', 'daerah', 'sy', 'cipinang', 'besar', 'selatan', 'rt', 'number', 'rw', 'number', 'nya', 'tdk', 'prnh', 'aware', 'dgn', 'warganya', 'setiap', 'ada', 'bantuan', 'tidak', 'pernah', 'transparansi', 'kejadian', 'covid', 'ini', 'jg', 'tidak', 'ada', 'tindakan', 'semprot', 'disinfektan', 'dbd', 'jg', 'banyak', 'tp', 'tidak', 'ada', 'fogging', 'tp', 'uang', 'kas', 'ttp', 'jalan'];['pagi', 'repeated', 'kenapa', 'iya', 'di', 'daerah', 'saya', 'cipinang', 'besar', 'selatan', 'rt', 'number', 'rw', 'number', 'nya', 'tidak', 'prnh', 'aware', 'dengan', 'warganya', 'setiap', 'ada', 'bantuan', 'tidak', 'pernah', 'transparansi', 'kejadian', 'covid', 'ini', 'jg', 'tidak', 'ada', 'tindakan', 'semprot', 'disinfektan', 'dbd', 'jg', 'banyak', 'tapi', 'tidak', 'ada', 'fogging', 'tapi', 'uang', 'kas', 'tetap', 'jalan'];['pagi', 'repeated', 'iya', 'daerah', 'cipinang', 'selatan', 'rt', 'number', 'rw', 'number', 'nya', 'prnh', 'aware', 'warganya', 'bantuan', 'transparansi', 'kejadian', 'covid', 'jg', 'tindakan', 'semprot', 'disinfektan', 'dbd', 'jg', 'fogging', 'uang', 'kas', 'jalan'];pagi repeated iya daerah cipinang selatan rt number rw number nya prnh aware warganya bantuan transparansi kejadian covid jg tindakan semprot disinfektan dbd jg fogging uang kas jalan;pagi repeated iya daerah cipinang selatan rt number rw number nya prnh aware warga bantu transparansi jadi covid jg tindak semprot disinfektan dbd jg fogging uang kas jalan
461;Kementerian Agama Provinsi Papua Barat, Azis Hegemur mengatakan, Umat Islam diProvinsi Papua Barat diimbau agar tidak menolak pemakaman jenazah pasien positifterjangkit Covid-19. OPM;1.0;kementerian agama provinsi papua barat azis hegemur mengatakan umat islam diprovinsi papua barat diimbau agar tidak menolak pemakaman jenazah pasien positifterjangkit covid number allcaps opm allcaps;['kementerian', 'agama', 'provinsi', 'papua', 'barat', 'azis', 'hegemur', 'mengatakan', 'umat', 'islam', 'diprovinsi', 'papua', 'barat', 'diimbau', 'agar', 'tidak', 'menolak', 'pemakaman', 'jenazah', 'pasien', 'positifterjangkit', 'covid', 'number', 'allcaps', 'opm', 'allcaps'];['kementerian', 'agama', 'provinsi', 'papua', 'barat', 'azis', 'hegemur', 'mengatakan', 'umat', 'islam', 'diprovinsi', 'papua', 'barat', 'diimbau', 'agar', 'tidak', 'menolak', 'pemakaman', 'jenazah', 'pasien', 'positifterjangkit', 'covid', 'number', 'allcaps', 'opm', 'allcaps'];['kementerian', 'agama', 'provinsi', 'papua', 'barat', 'azis', 'hegemur', 'umat', 'islam', 'diprovinsi', 'papua', 'barat', 'diimbau', 'menolak', 'pemakaman', 'jenazah', 'pasien', 'positifterjangkit', 'covid', 'number', 'allcaps', 'opm', 'allcaps'];kementerian agama provinsi papua barat azis hegemur umat islam diprovinsi papua barat diimbau menolak pemakaman jenazah pasien positifterjangkit covid number allcaps opm allcaps;menteri agama provinsi papua barat azis hegemur umat islam provinsi papua barat imbau tolak makam jenazah pasien positifterjangkit covid number allcaps opm allcaps
462;Hei guys, gw mau ngajak kalian untuk agar pandemik covid-19 ini lekas hilang. AamiinGimana??Kurangin dah tuh nongki2, halan2, atau segala aktivitas diluar ruangan. Yuk belajar utbk aja, tau sendirikan pesaing lo tuh buanyak banget. Yok ;1.0;hei guys gw mau ngajak kalian untuk agar pandemik covid number ini lekas hilang aamiingimana repeated kurangin dah tuh nongki2 halan2 atau segala aktivitas diluar ruangan yuk belajar utbk aja tau sendirikan pesaing lo tuh buanyak banget yok;['hei', 'guys', 'gw', 'mau', 'ngajak', 'kalian', 'untuk', 'agar', 'pandemik', 'covid', 'number', 'ini', 'lekas', 'hilang', 'aamiingimana', 'repeated', 'kurangin', 'dah', 'tuh', 'nongki2', 'halan2', 'atau', 'segala', 'aktivitas', 'diluar', 'ruangan', 'yuk', 'belajar', 'utbk', 'aja', 'tau', 'sendirikan', 'pesaing', 'lo', 'tuh', 'buanyak', 'banget', 'yok'];['hei', 'guys', 'saya', 'mau', 'ngajak', 'kalian', 'untuk', 'agar', 'pandemik', 'covid', 'number', 'ini', 'lekas', 'hilang', 'aamiingimana', 'repeated', 'kurangin', 'sudah', 'itu', 'nongki2', 'halan2', 'atau', 'segala', 'aktivitas', 'diluar', 'ruangan', 'ayo', 'belajar', 'utbk', 'saja', 'tau', 'sendirikan', 'pesaing', 'lo', 'itu', 'buanyak', 'banget', 'yok'];['hei', 'guys', 'ngajak', 'pandemik', 'covid', 'number', 'lekas', 'hilang', 'aamiingimana', 'repeated', 'kurangin', 'nongki2', 'halan2', 'aktivitas', 'diluar', 'ruangan', 'ayo', 'belajar', 'utbk', 'tau', 'sendirikan', 'pesaing', 'lo', 'buanyak', 'banget', 'yok'];hei guys ngajak pandemik covid number lekas hilang aamiingimana repeated kurangin nongki2 halan2 aktivitas diluar ruangan ayo belajar utbk tau sendirikan pesaing lo buanyak banget yok;hei guys ngajak pandemik covid number lekas hilang aamiingimana repeated rangin nongki2 halan2 aktivitas luar ruang ayo ajar utbk tau sendiri saing lo buanyak banget yok
463;JANGAN ADA DUSTA DIANTARA KITA: Kisah Pilu Dokter Menangani Pasien Yang Ternyata Positif Covid-19  ;1.0;allcaps jangan ada dusta diantara kita allcaps kisah pilu dokter menangani pasien yang ternyata positif covid number;['allcaps', 'jangan', 'ada', 'dusta', 'diantara', 'kita', 'allcaps', 'kisah', 'pilu', 'dokter', 'menangani', 'pasien', 'yang', 'ternyata', 'positif', 'covid', 'number'];['allcaps', 'jangan', 'ada', 'dusta', 'diantara', 'kita', 'allcaps', 'kisah', 'pilu', 'dokter', 'menangani', 'pasien', 'yang', 'ternyata', 'positif', 'covid', 'number'];['allcaps', 'dusta', 'allcaps', 'kisah', 'pilu', 'dokter', 'menangani', 'pasien', 'positif', 'covid', 'number'];allcaps dusta allcaps kisah pilu dokter menangani pasien positif covid number;allcaps dusta allcaps kisah pilu dokter tangan pasien positif covid number
464;Saya kuatir test Covid-19 belum menyeluruhTau2 nanti ada korban tergeletak mati suspek coronaNgeri;-1.0;saya kuatir test covid number belum menyeluruhtau2 nanti ada korban tergeletak mati suspek coronangeri;['saya', 'kuatir', 'test', 'covid', 'number', 'belum', 'menyeluruhtau2', 'nanti', 'ada', 'korban', 'tergeletak', 'mati', 'suspek', 'coronangeri'];['saya', 'khawatir', 'test', 'covid', 'number', 'belum', 'menyeluruhtau2', 'nanti', 'ada', 'korban', 'tergeletak', 'mati', 'suspek', 'coronangeri'];['khawatir', 'test', 'covid', 'number', 'menyeluruhtau2', 'korban', 'tergeletak', 'mati', 'suspek', 'coronangeri'];khawatir test covid number menyeluruhtau2 korban tergeletak mati suspek coronangeri;khawatir test covid number menyeluruhtau2 korban geletak mati suspek coronangeri
465;Ada yang kek gue saking fokus sama berita soal covid hari ini siap siap kerja padahalan tanggal merah;0.0;ada yang kek gue saking fokus sama berita soal covid hari ini siap siap kerja padahalan tanggal merah;['ada', 'yang', 'kek', 'gue', 'saking', 'fokus', 'sama', 'berita', 'soal', 'covid', 'hari', 'ini', 'siap', 'siap', 'kerja', 'padahalan', 'tanggal', 'merah'];['ada', 'yang', 'kayak', 'saya', 'saking', 'fokus', 'sama', 'berita', 'soal', 'covid', 'hari', 'ini', 'siap', 'siap', 'kerja', 'padahalan', 'tanggal', 'merah'];['kayak', 'saking', 'fokus', 'berita', 'covid', 'kerja', 'padahalan', 'tanggal', 'merah'];kayak saking fokus berita covid kerja padahalan tanggal merah;kayak saking fokus berita covid kerja padahal tanggal merah
466;Berat Mbah, terlalu banyak kemungkinan: Sedang haid gak ndang mampet Jualan online gak payu-payu Lagi horny sing lanang mumet covid Sudah masak enak dapat berkatan yg lebih enak Sariawan Loro untu Keputihan Murus ilate kecakot Bengese anyar Masker kerlisut Dst...;0.0;berat mbah terlalu banyak kemungkinan sedang haid gak ndang mampet jualan online gak payu payu lagi horny sing lanang mumet covid sudah masak enak dapat berkatan yg lebih enak sariawan loro untu keputihan murus ilate kecakot bengese anyar masker kerlisut dst repeated;['berat', 'mbah', 'terlalu', 'banyak', 'kemungkinan', 'sedang', 'haid', 'gak', 'ndang', 'mampet', 'jualan', 'online', 'gak', 'payu', 'payu', 'lagi', 'horny', 'sing', 'lanang', 'mumet', 'covid', 'sudah', 'masak', 'enak', 'dapat', 'berkatan', 'yg', 'lebih', 'enak', 'sariawan', 'loro', 'untu', 'keputihan', 'murus', 'ilate', 'kecakot', 'bengese', 'anyar', 'masker', 'kerlisut', 'dst', 'repeated'];['berat', 'mbah', 'terlalu', 'banyak', 'kemungkinan', 'sedang', 'haid', 'tidak', 'ndang', 'mampet', 'jualan', 'online', 'tidak', 'payu', 'payu', 'lagi', 'horny', 'sing', 'lanang', 'pusing', 'covid', 'sudah', 'masak', 'enak', 'dapat', 'berkatan', 'yang', 'lebih', 'enak', 'sariawan', 'loro', 'untu', 'keputihan', 'murus', 'ilate', 'kecakot', 'bengese', 'anyar', 'masker', 'kerlisut', 'dst', 'repeated'];['berat', 'mbah', 'haid', 'ndang', 'mampet', 'jualan', 'online', 'payu', 'payu', 'horny', 'sing', 'lanang', 'pusing', 'covid', 'masak', 'enak', 'berkatan', 'enak', 'sariawan', 'loro', 'untu', 'keputihan', 'murus', 'ilate', 'kecakot', 'bengese', 'anyar', 'masker', 'kerlisut', 'dst', 'repeated'];berat mbah haid ndang mampet jualan online payu payu horny sing lanang pusing covid masak enak berkatan enak sariawan loro untu keputihan murus ilate kecakot bengese anyar masker kerlisut dst repeated;berat mbah haid ndang mampet jual online payu payu horny sing lanang pusing covid masak enak berkat enak sariawan loro untu putih murus ilate kecakot bengese anyar masker kerlisut dst repeated
467;Amalkan langkah-langkah pencegahan penularan COVID-19 sebagai amalan dalam kehidupan seharian kita.SHARING IS;0.0;amalkan langkah langkah pencegahan penularan allcaps covid allcaps number sebagai amalan dalam kehidupan seharian kita allcaps sharing is allcaps;['amalkan', 'langkah', 'langkah', 'pencegahan', 'penularan', 'allcaps', 'covid', 'allcaps', 'number', 'sebagai', 'amalan', 'dalam', 'kehidupan', 'seharian', 'kita', 'allcaps', 'sharing', 'is', 'allcaps'];['amalkan', 'langkah', 'langkah', 'pencegahan', 'penularan', 'allcaps', 'covid', 'allcaps', 'number', 'sebagai', 'amalan', 'dalam', 'kehidupan', 'seharian', 'kita', 'allcaps', 'sharing', 'is', 'allcaps'];['amalkan', 'langkah', 'langkah', 'pencegahan', 'penularan', 'allcaps', 'covid', 'allcaps', 'number', 'amalan', 'kehidupan', 'seharian', 'allcaps', 'sharing', 'is', 'allcaps'];amalkan langkah langkah pencegahan penularan allcaps covid allcaps number amalan kehidupan seharian allcaps sharing is allcaps;amal langkah langkah cegah tular allcaps covid allcaps number amal hidup hari allcaps sharing is allcaps
468;Bumi..Maafkan Kami..Yang Tak Pernah Sadar.. Bahwa Kau Juga Butuh Istirahat.;1.0;bumi repeated maafkan kami repeated yang tak pernah sadar repeated bahwa kau juga butuh istirahat;['bumi', 'repeated', 'maafkan', 'kami', 'repeated', 'yang', 'tak', 'pernah', 'sadar', 'repeated', 'bahwa', 'kau', 'juga', 'butuh', 'istirahat'];['bumi', 'repeated', 'maafkan', 'kami', 'repeated', 'yang', 'tak', 'pernah', 'sadar', 'repeated', 'bahwa', 'kau', 'juga', 'butuh', 'istirahat'];['bumi', 'repeated', 'maafkan', 'repeated', 'sadar', 'repeated', 'kau', 'butuh', 'istirahat'];bumi repeated maafkan repeated sadar repeated kau butuh istirahat;bumi repeated maaf repeated sadar repeated kau butuh istirahat
469;Anggota Polsek Koba Himbau para pemuda Tidak Kumpul-kumpul dan segera pulang kerumahnya masing-masing untuk mencegah penyebaran COVID-19..  ;1.0;anggota polsek koba himbau para pemuda tidak kumpul kumpul dan segera pulang kerumahnya masing masing untuk mencegah penyebaran allcaps covid allcaps number repeated;['anggota', 'polsek', 'koba', 'himbau', 'para', 'pemuda', 'tidak', 'kumpul', 'kumpul', 'dan', 'segera', 'pulang', 'kerumahnya', 'masing', 'masing', 'untuk', 'mencegah', 'penyebaran', 'allcaps', 'covid', 'allcaps', 'number', 'repeated'];['anggota', 'polsek', 'koba', 'himbau', 'para', 'pemuda', 'tidak', 'kumpul', 'kumpul', 'dan', 'segera', 'pulang', 'kerumahnya', 'masing', 'masing', 'untuk', 'mencegah', 'penyebaran', 'allcaps', 'covid', 'allcaps', 'number', 'repeated'];['anggota', 'polsek', 'koba', 'himbau', 'pemuda', 'kumpul', 'kumpul', 'pulang', 'kerumahnya', 'mencegah', 'penyebaran', 'allcaps', 'covid', 'allcaps', 'number', 'repeated'];anggota polsek koba himbau pemuda kumpul kumpul pulang kerumahnya mencegah penyebaran allcaps covid allcaps number repeated;anggota polsek koba himbau pemuda kumpul kumpul pulang rumah cegah sebar allcaps covid allcaps number repeated
470;Kopi pagi ini cukup nikmat.Kabar baiknya pemerintah Aceh menyalurkan bantuan pokok utk Masyarakat terdampak Covid-19 dgn kriteria bukan penerima PKH & BPNT. Alhamdulillah ;1.0;kopi pagi ini cukup nikmat kabar baiknya pemerintah aceh menyalurkan bantuan pokok utk masyarakat terdampak covid number dgn kriteria bukan penerima allcaps pkh allcaps allcaps bpnt allcaps alhamdulillah;['kopi', 'pagi', 'ini', 'cukup', 'nikmat', 'kabar', 'baiknya', 'pemerintah', 'aceh', 'menyalurkan', 'bantuan', 'pokok', 'utk', 'masyarakat', 'terdampak', 'covid', 'number', 'dgn', 'kriteria', 'bukan', 'penerima', 'allcaps', 'pkh', 'allcaps', 'allcaps', 'bpnt', 'allcaps', 'alhamdulillah'];['kopi', 'pagi', 'ini', 'cukup', 'nikmat', 'kabar', 'baiknya', 'pemerintah', 'aceh', 'menyalurkan', 'bantuan', 'pokok', 'untuk', 'masyarakat', 'terdampak', 'covid', 'number', 'dengan', 'kriteria', 'bukan', 'penerima', 'allcaps', 'pkh', 'allcaps', 'allcaps', 'bpnt', 'allcaps', 'syukur'];['kopi', 'pagi', 'nikmat', 'kabar', 'baiknya', 'pemerintah', 'aceh', 'menyalurkan', 'bantuan', 'pokok', 'masyarakat', 'terdampak', 'covid', 'number', 'kriteria', 'penerima', 'allcaps', 'pkh', 'allcaps', 'allcaps', 'bpnt', 'allcaps', 'syukur'];kopi pagi nikmat kabar baiknya pemerintah aceh menyalurkan bantuan pokok masyarakat terdampak covid number kriteria penerima allcaps pkh allcaps allcaps bpnt allcaps syukur;kopi pagi nikmat kabar baik perintah aceh salur bantu pokok masyarakat dampak covid number kriteria terima allcaps pkh allcaps allcaps bpnt allcaps syukur
471;Sugeng ambal Warso... Yg buat ak n kita bahgia saat ini adalah covid segera teratasi dan semua bisa melakukan kegiatan seperti biasa...;1.0;sugeng ambal warso repeated yg buat ak kita bahgia saat ini adalah covid segera teratasi dan semua bisa melakukan kegiatan seperti biasa repeated;['sugeng', 'ambal', 'warso', 'repeated', 'yg', 'buat', 'ak', 'kita', 'bahgia', 'saat', 'ini', 'adalah', 'covid', 'segera', 'teratasi', 'dan', 'semua', 'bisa', 'melakukan', 'kegiatan', 'seperti', 'biasa', 'repeated'];['sugeng', 'ambal', 'warso', 'repeated', 'yang', 'buat', 'aku', 'kita', 'bahgia', 'saat', 'ini', 'adalah', 'covid', 'segera', 'teratasi', 'dan', 'semua', 'bisa', 'melakukan', 'kegiatan', 'seperti', 'biasa', 'repeated'];['sugeng', 'ambal', 'warso', 'repeated', 'bahgia', 'covid', 'teratasi', 'kegiatan', 'repeated'];sugeng ambal warso repeated bahgia covid teratasi kegiatan repeated;sugeng ambal warso repeated bahgia covid atas giat repeated
