;Tweet;Sentimen;step01;tokens;tokens_perbaikan;Stop_removal;step02;ProcessedText
654;Biasanya yg jadi judul di sinetron-sinetron Hidayah itu Azab Orang yang bla bla bla, Jenazah Ditolak Bumi. Lah ini, pemberitaan Covid-19  Jenazah Ditolak Warga. HEH WARGA!!!! Jangan ngadi-ngadi lu! Gausah bikin makin repot!! HIH SEWOT AKUTU;-1.0;biasanya yg jadi judul di sinetron sinetron hidayah itu azab orang yang bla bla bla jenazah ditolak bumi lah ini pemberitaan covid number jenazah ditolak warga allcaps heh warga allcaps repeated jangan ngadi ngadi lu gausah bikin makin repot repeated allcaps hih sewot akutu allcaps;['biasanya', 'yg', 'jadi', 'judul', 'di', 'sinetron', 'sinetron', 'hidayah', 'itu', 'azab', 'orang', 'yang', 'bla', 'bla', 'bla', 'jenazah', 'ditolak', 'bumi', 'lah', 'ini', 'pemberitaan', 'covid', 'number', 'jenazah', 'ditolak', 'warga', 'allcaps', 'heh', 'warga', 'allcaps', 'repeated', 'jangan', 'ngadi', 'ngadi', 'lu', 'gausah', 'bikin', 'makin', 'repot', 'repeated', 'allcaps', 'hih', 'sewot', 'akutu', 'allcaps'];['biasanya', 'yang', 'jadi', 'judul', 'di', 'sinetron', 'sinetron', 'hidayah', 'itu', 'azab', 'orang', 'yang', 'bla', 'bla', 'bla', 'jenazah', 'ditolak', 'bumi', 'lah', 'ini', 'pemberitaan', 'covid', 'number', 'jenazah', 'ditolak', 'warga', 'allcaps', 'heh', 'warga', 'allcaps', 'repeated', 'jangan', 'ngadi', 'ngadi', 'kamu', 'gausah', 'membuat', 'makin', 'repot', 'repeated', 'allcaps', 'hih', 'sewot', 'akutu', 'allcaps'];['judul', 'sinetron', 'sinetron', 'hidayah', 'azab', 'orang', 'bla', 'bla', 'bla', 'jenazah', 'ditolak', 'bumi', 'pemberitaan', 'covid', 'number', 'jenazah', 'ditolak', 'warga', 'allcaps', 'heh', 'warga', 'allcaps', 'repeated', 'ngadi', 'ngadi', 'gausah', 'repot', 'repeated', 'allcaps', 'hih', 'sewot', 'akutu', 'allcaps'];judul sinetron sinetron hidayah azab orang bla bla bla jenazah ditolak bumi pemberitaan covid number jenazah ditolak warga allcaps heh warga allcaps repeated ngadi ngadi gausah repot repeated allcaps hih sewot akutu allcaps;judul sinetron sinetron hidayah azab orang bla bla bla jenazah tolak bumi berita covid number jenazah tolak warga allcaps heh warga allcaps repeated ngadi ngadi gausah repot repeated allcaps hih sewot akutu allcaps
655;Tiga Warga Magelang Dirawat Terkait Covid-19 RS Budi Rahayu Tertutup Untuk Pasien Umum;1.0;tiga warga magelang dirawat terkait covid number rs budi rahayu tertutup untuk pasien umum;['tiga', 'warga', 'magelang', 'dirawat', 'terkait', 'covid', 'number', 'rs', 'budi', 'rahayu', 'tertutup', 'untuk', 'pasien', 'umum'];['tiga', 'warga', 'magelang', 'dirawat', 'terkait', 'covid', 'number', 'rs', 'budi', 'rahayu', 'tertutup', 'untuk', 'pasien', 'umum'];['warga', 'magelang', 'dirawat', 'terkait', 'covid', 'number', 'rs', 'budi', 'rahayu', 'tertutup', 'pasien'];warga magelang dirawat terkait covid number rs budi rahayu tertutup pasien;warga magelang rawat kait covid number rs budi rahayu tutup pasien
656;Provokator Penolak Jenazah Covid-19 Ditangkap Polda Jawa Tengah, Ini Rinciannya;0.0;provokator penolak jenazah covid number ditangkap polda jawa tengah ini rinciannya;['provokator', 'penolak', 'jenazah', 'covid', 'number', 'ditangkap', 'polda', 'jawa', 'tengah', 'ini', 'rinciannya'];['provokator', 'penolak', 'jenazah', 'covid', 'number', 'ditangkap', 'polda', 'jawa', 'tengah', 'ini', 'rinciannya'];['provokator', 'penolak', 'jenazah', 'covid', 'number', 'ditangkap', 'polda', 'jawa', 'rinciannya'];provokator penolak jenazah covid number ditangkap polda jawa rinciannya;provokator tolak jenazah covid number tangkap polda jawa rinciannya
657;Update covid-19 prov papuaSarmi mengalami kenaikan.Lindungi semua hambamu Ya Allah..;1.0;update covid number prov papuasarmi mengalami kenaikan lindungi semua hambamu ya allah repeated;['update', 'covid', 'number', 'prov', 'papuasarmi', 'mengalami', 'kenaikan', 'lindungi', 'semua', 'hambamu', 'ya', 'allah', 'repeated'];['update', 'covid', 'number', 'prov', 'papuasarmi', 'mengalami', 'kenaikan', 'lindungi', 'semua', 'hambamu', 'iya', 'allah', 'repeated'];['update', 'covid', 'number', 'prov', 'papuasarmi', 'mengalami', 'kenaikan', 'lindungi', 'hambamu', 'iya', 'allah', 'repeated'];update covid number prov papuasarmi mengalami kenaikan lindungi hambamu iya allah repeated;update covid number prov papuasarmi alami naik lindung hamba iya allah repeated
658;Gue jg kadang suka kepikiran kali lg covid begini trs tbtb ada bencana besar (gempa/tsunami) gmn ya, tp ya random thoughts aja gitu. Inilah herannya org indo, ngasih tau fakta covid dibilang bikin panik giliran mitos indigo lo baca ampe kelar. Buset.;-1.0;gue jg kadang suka kepikiran kali lg covid begini trs tbtb ada bencana besar gempa tsunami gmn ya tp ya random thoughts aja gitu inilah herannya org indo ngasih tau fakta covid dibilang bikin panik giliran mitos indigo lo baca ampe kelar buset;['gue', 'jg', 'kadang', 'suka', 'kepikiran', 'kali', 'lg', 'covid', 'begini', 'trs', 'tbtb', 'ada', 'bencana', 'besar', 'gempa', 'tsunami', 'gmn', 'ya', 'tp', 'ya', 'random', 'thoughts', 'aja', 'gitu', 'inilah', 'herannya', 'org', 'indo', 'ngasih', 'tau', 'fakta', 'covid', 'dibilang', 'bikin', 'panik', 'giliran', 'mitos', 'indigo', 'lo', 'baca', 'ampe', 'kelar', 'buset'];['saya', 'jg', 'kadang', 'suka', 'kepikiran', 'kali', 'lg', 'covid', 'begini', 'terus', 'tbtb', 'ada', 'bencana', 'besar', 'gempa', 'tsunami', 'bagaimana', 'iya', 'tapi', 'iya', 'random', 'thoughts', 'saja', 'gitu', 'inilah', 'herannya', 'orang', 'indo', 'memberi', 'tau', 'fakta', 'covid', 'dibilang', 'membuat', 'panik', 'giliran', 'mitos', 'indigo', 'lo', 'baca', 'ampe', 'selesai', 'aduh'];['jg', 'kadang', 'suka', 'kepikiran', 'kali', 'lg', 'covid', 'tbtb', 'bencana', 'gempa', 'tsunami', 'iya', 'iya', 'random', 'thoughts', 'gitu', 'herannya', 'orang', 'indo', 'tau', 'fakta', 'covid', 'dibilang', 'panik', 'giliran', 'mitos', 'indigo', 'lo', 'baca', 'ampe', 'selesai', 'aduh'];jg kadang suka kepikiran kali lg covid tbtb bencana gempa tsunami iya iya random thoughts gitu herannya orang indo tau fakta covid dibilang panik giliran mitos indigo lo baca ampe selesai aduh;jg kadang suka pikir kali lg covid tbtb bencana gempa tsunami iya iya random thoughts gitu heran orang indo tau fakta covid bilang panik gilir mitos indigo lo baca ampe selesai aduh
659;Jubir Covid-19 Minta Warga Tak Menolak Jenazah Corona ;1.0;jubir covid number minta warga tak menolak jenazah corona;['jubir', 'covid', 'number', 'minta', 'warga', 'tak', 'menolak', 'jenazah', 'corona'];['jubir', 'covid', 'number', 'minta', 'warga', 'tak', 'menolak', 'jenazah', 'corona'];['jubir', 'covid', 'number', 'warga', 'menolak', 'jenazah', 'corona'];jubir covid number warga menolak jenazah corona;jubir covid number warga tolak jenazah corona
660;males komentar udah tau lg covid 19malah pengen kumpul2 parahhhhhh...;-1.0;males komentar udah tau lg covid 1 9 malah pengen kumpul2 parah elongated repeated;['males', 'komentar', 'udah', 'tau', 'lg', 'covid', '1', '9', 'malah', 'pengen', 'kumpul2', 'parah', 'elongated', 'repeated'];['malas ', 'komentar', 'sudah', 'tau', 'lg', 'covid', '1', '9', 'malah', 'ingin', 'kumpul2', 'parah', 'elongated', 'repeated'];['malas ', 'komentar', 'tau', 'lg', 'covid', '1', '9', 'kumpul2', 'parah', 'elongated', 'repeated'];malas  komentar tau lg covid 1 9 kumpul2 parah elongated repeated;malas komentar tau lg covid 1 9 kumpul2 parah elongated repeated
661;Tetap Terima Pelanggan, Tukang Gunting Rambut Meninggal Dunia Angkara COVID-19;-1.0;tetap terima pelanggan tukang gunting rambut meninggal dunia angkara allcaps covid allcaps number;['tetap', 'terima', 'pelanggan', 'tukang', 'gunting', 'rambut', 'meninggal', 'dunia', 'angkara', 'allcaps', 'covid', 'allcaps', 'number'];['tetap', 'terima', 'pelanggan', 'tukang', 'gunting', 'rambut', 'meninggal', 'dunia', 'angkara', 'allcaps', 'covid', 'allcaps', 'number'];['terima', 'pelanggan', 'tukang', 'gunting', 'rambut', 'meninggal', 'dunia', 'angkara', 'allcaps', 'covid', 'allcaps', 'number'];terima pelanggan tukang gunting rambut meninggal dunia angkara allcaps covid allcaps number;terima langgan tukang gunting rambut tinggal dunia angkara allcaps covid allcaps number
662;Pesan Pencegahan Covid-19 Disorot, Ridwan Kamil Pakai Masker Gambar Syahrini: Corona Hus Sanah!;1.0;pesan pencegahan covid number disorot ridwan kamil pakai masker gambar syahrini corona hus sanah;['pesan', 'pencegahan', 'covid', 'number', 'disorot', 'ridwan', 'kamil', 'pakai', 'masker', 'gambar', 'syahrini', 'corona', 'hus', 'sanah'];['pesan', 'pencegahan', 'covid', 'number', 'disorot', 'ridwan', 'kamil', 'pakai', 'masker', 'gambar', 'syahrini', 'corona', 'hus', 'sanah'];['pesan', 'pencegahan', 'covid', 'number', 'disorot', 'ridwan', 'kamil', 'pakai', 'masker', 'gambar', 'syahrini', 'corona', 'hus', 'sanah'];pesan pencegahan covid number disorot ridwan kamil pakai masker gambar syahrini corona hus sanah;pesan cegah covid number sorot ridwan kamil pakai masker gambar syahrini corona hus sanah
663;3 Terduga Provokator Penolakan Jenazah Perawat Semarang Diamankan Polisi Terimaksih Polri saya apresiasi tindakan polisi yg memproses org yg menghalagi pemakaman jenazah covid-19. Biar ada efek jera &  tidak terjadi lagi di tempat lain. ;1.0;number terduga provokator penolakan jenazah perawat semarang diamankan polisi terimaksih polri saya apresiasi tindakan polisi yg memproses org yg menghalagi pemakaman jenazah covid number biar ada efek jera tidak terjadi lagi di tempat lain;['number', 'terduga', 'provokator', 'penolakan', 'jenazah', 'perawat', 'semarang', 'diamankan', 'polisi', 'terimaksih', 'polri', 'saya', 'apresiasi', 'tindakan', 'polisi', 'yg', 'memproses', 'org', 'yg', 'menghalagi', 'pemakaman', 'jenazah', 'covid', 'number', 'biar', 'ada', 'efek', 'jera', 'tidak', 'terjadi', 'lagi', 'di', 'tempat', 'lain'];['number', 'terduga', 'provokator', 'penolakan', 'jenazah', 'perawat', 'semarang', 'diamankan', 'polisi', 'terimaksih', 'polri', 'saya', 'apresiasi', 'tindakan', 'polisi', 'yang', 'memproses', 'orang', 'yang', 'menghalagi', 'pemakaman', 'jenazah', 'covid', 'number', 'biar', 'ada', 'efek', 'jera', 'tidak', 'terjadi', 'lagi', 'di', 'tempat', 'lain'];['number', 'terduga', 'provokator', 'penolakan', 'jenazah', 'perawat', 'semarang', 'diamankan', 'polisi', 'terimaksih', 'polri', 'apresiasi', 'tindakan', 'polisi', 'memproses', 'orang', 'menghalagi', 'pemakaman', 'jenazah', 'covid', 'number', 'biar', 'efek', 'jera'];number terduga provokator penolakan jenazah perawat semarang diamankan polisi terimaksih polri apresiasi tindakan polisi memproses orang menghalagi pemakaman jenazah covid number biar efek jera;number duga provokator tolak jenazah awat semarang aman polisi terimaksih polri apresiasi tindak polisi proses orang menghalagi makam jenazah covid number biar efek jera
664;Banjir, Covid-19, Dentuman Misterius, sekarang prediksi gempa. Gua up sama 2020;-1.0;banjir covid number dentuman misterius sekarang prediksi gempa gua up sama number;['banjir', 'covid', 'number', 'dentuman', 'misterius', 'sekarang', 'prediksi', 'gempa', 'gua', 'up', 'sama', 'number'];['banjir', 'covid', 'number', 'dentuman', 'misterius', 'sekarang', 'prediksi', 'gempa', 'saya', 'up', 'sama', 'number'];['banjir', 'covid', 'number', 'dentuman', 'misterius', 'prediksi', 'gempa', 'up', 'number'];banjir covid number dentuman misterius prediksi gempa up number;banjir covid number dentum misterius prediksi gempa up number
665;Bupati Klaten menghimbau masyarakat untuk tidak takut, tidak panik lakukan PHBS, makan makanan yang bergizi, dan berjemur antara jam 9-10 pagi selama 10-15 menit guna pencegahan Covid-19;1.0;bupati klaten menghimbau masyarakat untuk tidak takut tidak panik lakukan allcaps phbs allcaps makan makanan yang bergizi dan berjemur antara jam number number pagi selama number number menit guna pencegahan covid number;['bupati', 'klaten', 'menghimbau', 'masyarakat', 'untuk', 'tidak', 'takut', 'tidak', 'panik', 'lakukan', 'allcaps', 'phbs', 'allcaps', 'makan', 'makanan', 'yang', 'bergizi', 'dan', 'berjemur', 'antara', 'jam', 'number', 'number', 'pagi', 'selama', 'number', 'number', 'menit', 'guna', 'pencegahan', 'covid', 'number'];['bupati', 'klaten', 'menghimbau', 'masyarakat', 'untuk', 'tidak', 'takut', 'tidak', 'panik', 'lakukan', 'allcaps', 'phbs', 'allcaps', 'makan', 'makanan', 'yang', 'bergizi', 'dan', 'berjemur', 'antara', 'jam', 'number', 'number', 'pagi', 'selama', 'number', 'number', 'menit', 'guna', 'pencegahan', 'covid', 'number'];['bupati', 'klaten', 'menghimbau', 'masyarakat', 'takut', 'panik', 'lakukan', 'allcaps', 'phbs', 'allcaps', 'makan', 'makanan', 'bergizi', 'berjemur', 'jam', 'number', 'number', 'pagi', 'number', 'number', 'menit', 'pencegahan', 'covid', 'number'];bupati klaten menghimbau masyarakat takut panik lakukan allcaps phbs allcaps makan makanan bergizi berjemur jam number number pagi number number menit pencegahan covid number;bupati klaten menghimbau masyarakat takut panik laku allcaps phbs allcaps makan makan gizi jemur jam number number pagi number number menit cegah covid number
666;sidakarya, pakerisan, panjer, pancoran, sesetan. red zone sudah covid ;0.0;sidakarya pakerisan panjer pancoran sesetan red zone sudah covid;['sidakarya', 'pakerisan', 'panjer', 'pancoran', 'sesetan', 'red', 'zone', 'sudah', 'covid'];['sidakarya', 'pakerisan', 'panjer', 'pancoran', 'sesetan', 'red', 'zone', 'sudah', 'covid'];['sidakarya', 'pakerisan', 'panjer', 'pancoran', 'sesetan', 'red', 'zone', 'covid'];sidakarya pakerisan panjer pancoran sesetan red zone covid;sidakarya pakerisan panjer pancoran set red zone covid
667;"Ini ngapa si ada yg mara mara""Tobat ya tobat aja, ngp segala ngetwit sih. Pake segala nanya apa masih bisa""Yaampun mase nanti kita jalan jalan ke pantai ya kalo covid-19 dah kelar, ku mau menenggelamkan kamu, bersama kejulidan mu, anying sia! Serius amat sih";-1.0;ini ngapa si ada yg mara mara tobat ya tobat aja ngp segala ngetwit sih pake segala nanya apa masih bisa yaampun mase nanti kita jalan jalan ke pantai ya kalo covid number dah kelar ku mau menenggelamkan kamu bersama kejulidan mu anying sia serius amat sih;['ini', 'ngapa', 'si', 'ada', 'yg', 'mara', 'mara', 'tobat', 'ya', 'tobat', 'aja', 'ngp', 'segala', 'ngetwit', 'sih', 'pake', 'segala', 'nanya', 'apa', 'masih', 'bisa', 'yaampun', 'mase', 'nanti', 'kita', 'jalan', 'jalan', 'ke', 'pantai', 'ya', 'kalo', 'covid', 'number', 'dah', 'kelar', 'ku', 'mau', 'menenggelamkan', 'kamu', 'bersama', 'kejulidan', 'mu', 'anying', 'sia', 'serius', 'amat', 'sih'];['ini', 'ngapa', 'sih', 'ada', 'yang', 'mara', 'mara', 'tobat', 'iya', 'tobat', 'saja', 'ngp', 'segala', 'ngetwit', 'sih', 'pakai', 'segala', 'nanya', 'apa', 'masih', 'bisa', 'yaampun', 'mase', 'nanti', 'kita', 'jalan', 'jalan', 'ke', 'pantai', 'iya', 'kalau', 'covid', 'number', 'sudah', 'selesai', 'ku', 'mau', 'menenggelamkan', 'kamu', 'bersama', 'kejulidan', 'mu', 'anying', 'sia', 'serius', 'amat', 'sih'];['ngapa', 'sih', 'mara', 'mara', 'tobat', 'iya', 'tobat', 'ngp', 'ngetwit', 'sih', 'pakai', 'nanya', 'yaampun', 'mase', 'jalan', 'jalan', 'pantai', 'iya', 'covid', 'number', 'selesai', 'ku', 'menenggelamkan', 'kejulidan', 'mu', 'anying', 'sia', 'serius', 'sih'];ngapa sih mara mara tobat iya tobat ngp ngetwit sih pakai nanya yaampun mase jalan jalan pantai iya covid number selesai ku menenggelamkan kejulidan mu anying sia serius sih;ngapa sih mara mara tobat iya tobat ngp ngetwit sih pakai nanya yaampun mase jalan jalan pantai iya covid number selesai ku tenggelam kejulidan mu anying sia serius sih
668;Cegah Penularan Covid-19, PTSP Serahkan Tempat Cuci Tangan untuk Balai Kota Padang dan Pasar Nanggalo;1.0;cegah penularan covid number allcaps ptsp allcaps serahkan tempat cuci tangan untuk balai kota padang dan pasar nanggalo;['cegah', 'penularan', 'covid', 'number', 'allcaps', 'ptsp', 'allcaps', 'serahkan', 'tempat', 'cuci', 'tangan', 'untuk', 'balai', 'kota', 'padang', 'dan', 'pasar', 'nanggalo'];['cegah', 'penularan', 'covid', 'number', 'allcaps', 'ptsp', 'allcaps', 'serahkan', 'tempat', 'cuci', 'tangan', 'untuk', 'balai', 'kota', 'padang', 'dan', 'pasar', 'nanggalo'];['cegah', 'penularan', 'covid', 'number', 'allcaps', 'ptsp', 'allcaps', 'serahkan', 'cuci', 'tangan', 'balai', 'kota', 'padang', 'pasar', 'nanggalo'];cegah penularan covid number allcaps ptsp allcaps serahkan cuci tangan balai kota padang pasar nanggalo;cegah tular covid number allcaps ptsp allcaps serah cuci tangan balai kota padang pasar nanggalo
669;Untuk pasien positif/terkonfirmasi Covid-19 baru berjumlah 1 orang. Total pasien positif/terkonfirmasi Covid-19 di Klaten sampai hari ini berjumlah 2 orang;0.0;untuk pasien positif terkonfirmasi covid number baru berjumlah number orang total pasien positif terkonfirmasi covid number di klaten sampai hari ini berjumlah number orang;['untuk', 'pasien', 'positif', 'terkonfirmasi', 'covid', 'number', 'baru', 'berjumlah', 'number', 'orang', 'total', 'pasien', 'positif', 'terkonfirmasi', 'covid', 'number', 'di', 'klaten', 'sampai', 'hari', 'ini', 'berjumlah', 'number', 'orang'];['untuk', 'pasien', 'positif', 'terkonfirmasi', 'covid', 'number', 'baru', 'berjumlah', 'number', 'orang', 'total', 'pasien', 'positif', 'terkonfirmasi', 'covid', 'number', 'di', 'klaten', 'sampai', 'hari', 'ini', 'berjumlah', 'number', 'orang'];['pasien', 'positif', 'terkonfirmasi', 'covid', 'number', 'number', 'orang', 'total', 'pasien', 'positif', 'terkonfirmasi', 'covid', 'number', 'klaten', 'number', 'orang'];pasien positif terkonfirmasi covid number number orang total pasien positif terkonfirmasi covid number klaten number orang;pasien positif konfirmasi covid number number orang total pasien positif konfirmasi covid number klaten number orang
670;Kasus pasien meninggal dunia akibat Covid-19 pertama kalinya terjadi di Kalimantan Utara 1 orang, kemudian NTB 2 orang, dan Sulawesi Tenggara 4 orang.;0.0;kasus pasien meninggal dunia akibat covid number pertama kalinya terjadi di kalimantan utara number orang kemudian allcaps ntb allcaps number orang dan sulawesi tenggara number orang;['kasus', 'pasien', 'meninggal', 'dunia', 'akibat', 'covid', 'number', 'pertama', 'kalinya', 'terjadi', 'di', 'kalimantan', 'utara', 'number', 'orang', 'kemudian', 'allcaps', 'ntb', 'allcaps', 'number', 'orang', 'dan', 'sulawesi', 'tenggara', 'number', 'orang'];['kasus', 'pasien', 'meninggal', 'dunia', 'akibat', 'covid', 'number', 'pertama', 'kalinya', 'terjadi', 'di', 'kalimantan', 'utara', 'number', 'orang', 'kemudian', 'allcaps', 'ntb', 'allcaps', 'number', 'orang', 'dan', 'sulawesi', 'tenggara', 'number', 'orang'];['pasien', 'meninggal', 'dunia', 'akibat', 'covid', 'number', 'kalinya', 'kalimantan', 'utara', 'number', 'orang', 'allcaps', 'ntb', 'allcaps', 'number', 'orang', 'sulawesi', 'tenggara', 'number', 'orang'];pasien meninggal dunia akibat covid number kalinya kalimantan utara number orang allcaps ntb allcaps number orang sulawesi tenggara number orang;pasien tinggal dunia akibat covid number kali kalimantan utara number orang allcaps ntb allcaps number orang sulawesi tenggara number orang
671;Berhubung dengan adanya virus COVID-19 jika kalian ada menemukan benjolan di bawah kelamin jangan takun,itu biji kontol;-1.0;berhubung dengan adanya virus allcaps covid allcaps number jika kalian ada menemukan benjolan di bawah kelamin jangan takun itu biji kontol;['berhubung', 'dengan', 'adanya', 'virus', 'allcaps', 'covid', 'allcaps', 'number', 'jika', 'kalian', 'ada', 'menemukan', 'benjolan', 'di', 'bawah', 'kelamin', 'jangan', 'takun', 'itu', 'biji', 'kontol'];['berhubung', 'dengan', 'adanya', 'virus', 'allcaps', 'covid', 'allcaps', 'number', 'jika', 'kalian', 'ada', 'menemukan', 'benjolan', 'di', 'bawah', 'kelamin', 'jangan', 'takun', 'itu', 'biji', 'kontol'];['berhubung', 'virus', 'allcaps', 'covid', 'allcaps', 'number', 'menemukan', 'benjolan', 'kelamin', 'takun', 'biji', 'kontol'];berhubung virus allcaps covid allcaps number menemukan benjolan kelamin takun biji kontol;hubung virus allcaps covid allcaps number temu benjol kelamin takun biji kontol
672;CDC mengumumkan setiap orang wajib pakai masker di tempat umum untuk cegah penyebaran COVID-19. Tapi apakah aturan itu berlaku bagi orang-orang yang olahraga?;0.0;allcaps cdc allcaps mengumumkan setiap orang wajib pakai masker di tempat umum untuk cegah penyebaran allcaps covid allcaps number tapi apakah aturan itu berlaku bagi orang orang yang olahraga;['allcaps', 'cdc', 'allcaps', 'mengumumkan', 'setiap', 'orang', 'wajib', 'pakai', 'masker', 'di', 'tempat', 'umum', 'untuk', 'cegah', 'penyebaran', 'allcaps', 'covid', 'allcaps', 'number', 'tapi', 'apakah', 'aturan', 'itu', 'berlaku', 'bagi', 'orang', 'orang', 'yang', 'olahraga'];['allcaps', 'cdc', 'allcaps', 'mengumumkan', 'setiap', 'orang', 'wajib', 'pakai', 'masker', 'di', 'tempat', 'umum', 'untuk', 'cegah', 'penyebaran', 'allcaps', 'covid', 'allcaps', 'number', 'tapi', 'apakah', 'aturan', 'itu', 'berlaku', 'bagi', 'orang', 'orang', 'yang', 'olahraga'];['allcaps', 'cdc', 'allcaps', 'mengumumkan', 'orang', 'wajib', 'pakai', 'masker', 'cegah', 'penyebaran', 'allcaps', 'covid', 'allcaps', 'number', 'aturan', 'berlaku', 'orang', 'orang', 'olahraga'];allcaps cdc allcaps mengumumkan orang wajib pakai masker cegah penyebaran allcaps covid allcaps number aturan berlaku orang orang olahraga;allcaps cdc allcaps umum orang wajib pakai masker cegah sebar allcaps covid allcaps number atur laku orang orang olahraga
673;Pakar Peringatkan, Indonesia dan India Berpotensi Jadi Episenter Baru Covid-19;-1.0;pakar peringatkan indonesia dan india berpotensi jadi episenter baru covid number;['pakar', 'peringatkan', 'indonesia', 'dan', 'india', 'berpotensi', 'jadi', 'episenter', 'baru', 'covid', 'number'];['pakar', 'peringatkan', 'indonesia', 'dan', 'india', 'berpotensi', 'jadi', 'episenter', 'baru', 'covid', 'number'];['pakar', 'peringatkan', 'indonesia', 'india', 'berpotensi', 'episenter', 'covid', 'number'];pakar peringatkan indonesia india berpotensi episenter covid number;pakar ingat indonesia india potensi episenter covid number
674;pak mohon ditindak lanjuti perumahan sigi permai kota semarang, kec. Pedurungan, Kel, trogomulyo, akan mengadakan gotong royong malah akan melakukan senam bersama mohon dapat di mediasi karen tidak boleh mengumpulkan orang pada masa pandemi covid 19 ini,;1.0;pak mohon ditindak lanjuti perumahan sigi permai kota semarang kec pedurungan kel trogomulyo akan mengadakan gotong royong malah akan melakukan senam bersama mohon dapat di mediasi karen tidak boleh mengumpulkan orang pada masa pandemi covid number ini;['pak', 'mohon', 'ditindak', 'lanjuti', 'perumahan', 'sigi', 'permai', 'kota', 'semarang', 'kec', 'pedurungan', 'kel', 'trogomulyo', 'akan', 'mengadakan', 'gotong', 'royong', 'malah', 'akan', 'melakukan', 'senam', 'bersama', 'mohon', 'dapat', 'di', 'mediasi', 'karen', 'tidak', 'boleh', 'mengumpulkan', 'orang', 'pada', 'masa', 'pandemi', 'covid', 'number', 'ini'];['pak', 'mohon', 'ditindak', 'lanjuti', 'perumahan', 'sigi', 'permai', 'kota', 'semarang', 'kec', 'pedurungan', 'kel', 'trogomulyo', 'akan', 'mengadakan', 'gotong', 'royong', 'malah', 'akan', 'melakukan', 'senam', 'bersama', 'mohon', 'dapat', 'di', 'mediasi', 'karen', 'tidak', 'boleh', 'mengumpulkan', 'orang', 'pada', 'masa', 'pandemi', 'covid', 'number', 'ini'];['mohon', 'ditindak', 'lanjuti', 'perumahan', 'sigi', 'permai', 'kota', 'semarang', 'kec', 'pedurungan', 'kel', 'trogomulyo', 'mengadakan', 'gotong', 'royong', 'senam', 'mohon', 'mediasi', 'karen', 'mengumpulkan', 'orang', 'pandemi', 'covid', 'number'];mohon ditindak lanjuti perumahan sigi permai kota semarang kec pedurungan kel trogomulyo mengadakan gotong royong senam mohon mediasi karen mengumpulkan orang pandemi covid number;mohon tindak lanjut rumah sigi permai kota semarang kec pedurungan kel trogomulyo ada gotong royong senam mohon mediasi karen kumpul orang pandemi covid number
675;Di masa pandemi covid-19 seperti sekarang ini harga kebutuhan pokok cenderung naik harganya, salah satu jurus untuk meredam itu adalah alokasi impor raw sugar agar dpt diubah menjadi GKP dan diharapkan dapat mencukupi kebutuhan gula dalam negeri dan dapat menekan harga.;1.0;di masa pandemi covid number seperti sekarang ini harga kebutuhan pokok cenderung naik harganya salah satu jurus untuk meredam itu adalah alokasi impor raw sugar agar dpt diubah menjadi allcaps gkp allcaps dan diharapkan dapat mencukupi kebutuhan gula dalam negeri dan dapat menekan harga;['di', 'masa', 'pandemi', 'covid', 'number', 'seperti', 'sekarang', 'ini', 'harga', 'kebutuhan', 'pokok', 'cenderung', 'naik', 'harganya', 'salah', 'satu', 'jurus', 'untuk', 'meredam', 'itu', 'adalah', 'alokasi', 'impor', 'raw', 'sugar', 'agar', 'dpt', 'diubah', 'menjadi', 'allcaps', 'gkp', 'allcaps', 'dan', 'diharapkan', 'dapat', 'mencukupi', 'kebutuhan', 'gula', 'dalam', 'negeri', 'dan', 'dapat', 'menekan', 'harga'];['di', 'masa', 'pandemi', 'covid', 'number', 'seperti', 'sekarang', 'ini', 'harga', 'kebutuhan', 'pokok', 'cenderung', 'naik', 'harganya', 'salah', 'satu', 'jurus', 'untuk', 'meredam', 'itu', 'adalah', 'alokasi', 'impor', 'raw', 'sugar', 'agar', 'dapat ', 'diubah', 'menjadi', 'allcaps', 'gkp', 'allcaps', 'dan', 'diharapkan', 'dapat', 'mencukupi', 'kebutuhan', 'gula', 'dalam', 'negeri', 'dan', 'dapat', 'menekan', 'harga'];['pandemi', 'covid', 'number', 'harga', 'kebutuhan', 'pokok', 'cenderung', 'harganya', 'salah', 'jurus', 'meredam', 'alokasi', 'impor', 'raw', 'sugar', 'dapat ', 'diubah', 'allcaps', 'gkp', 'allcaps', 'diharapkan', 'mencukupi', 'kebutuhan', 'gula', 'negeri', 'menekan', 'harga'];pandemi covid number harga kebutuhan pokok cenderung harganya salah jurus meredam alokasi impor raw sugar dapat  diubah allcaps gkp allcaps diharapkan mencukupi kebutuhan gula negeri menekan harga;pandemi covid number harga butuh pokok cenderung harga salah jurus redam alokasi impor raw sugar dapat ubah allcaps gkp allcaps harap cukup butuh gula negeri tekan harga
