;Tweet;Sentimen;step01;tokens;tokens_perbaikan;Stop_removal;step02;ProcessedText
235;Banyak tanggal merah pas lagi wabah covid-19;0.0;banyak tanggal merah pas lagi wabah covid number;['banyak', 'tanggal', 'merah', 'pas', 'lagi', 'wabah', 'covid', 'number'];['banyak', 'tanggal', 'merah', 'cocok', 'lagi', 'wabah', 'covid', 'number'];['tanggal', 'merah', 'cocok', 'wabah', 'covid', 'number'];tanggal merah cocok wabah covid number;tanggal merah cocok wabah covid number
236;Pejuang covid..;1.0;pejuang covid repeated;['pejuang', 'covid', 'repeated'];['pejuang', 'covid', 'repeated'];['pejuang', 'covid', 'repeated'];pejuang covid repeated;juang covid repeated
237;Gpp nyai mendingan gitu hibur diri daripada keluar rumah, tetap sehat nyai semoga Alloh melindungi dan menjauhkan wabah covid utk kita semua aamiin YRA;1.0;gpp nyai mendingan gitu hibur diri daripada keluar rumah tetap sehat nyai semoga alloh melindungi dan menjauhkan wabah covid utk kita semua aamiin allcaps yra allcaps;['gpp', 'nyai', 'mendingan', 'gitu', 'hibur', 'diri', 'daripada', 'keluar', 'rumah', 'tetap', 'sehat', 'nyai', 'semoga', 'alloh', 'melindungi', 'dan', 'menjauhkan', 'wabah', 'covid', 'utk', 'kita', 'semua', 'aamiin', 'allcaps', 'yra', 'allcaps'];['baik', 'nyai', 'baiknya', 'gitu', 'hibur', 'diri', 'daripada', 'keluar', 'rumah', 'tetap', 'sehat', 'nyai', 'semoga', 'alloh', 'melindungi', 'dan', 'menjauhkan', 'wabah', 'covid', 'untuk', 'kita', 'semua', 'semoga', 'allcaps', 'yra', 'allcaps'];['nyai', 'baiknya', 'gitu', 'hibur', 'rumah', 'sehat', 'nyai', 'semoga', 'alloh', 'melindungi', 'menjauhkan', 'wabah', 'covid', 'semoga', 'allcaps', 'yra', 'allcaps'];nyai baiknya gitu hibur rumah sehat nyai semoga alloh melindungi menjauhkan wabah covid semoga allcaps yra allcaps;nyai baik gitu hibur rumah sehat nyai moga alloh lindung jauh wabah covid moga allcaps yra allcaps
238;30.000 Lebih Narapidana Bebas di Tengah Wabah Covid-19, Termasuk Koruptor?Kebayang ga sih klo kita sudah susah payah menangkap tikus sampai dapat banyak bgt -itupun blm semuanya-, eeehh... Tau2 mau dilepaskan. Kyk apa jadinya rumah kita? ;0.0;number lebih narapidana bebas di tengah wabah covid number termasuk koruptor kebayang ga sih klo kita sudah susah payah menangkap tikus sampai dapat banyak bgt itupun blm semuanya eh elongated repeated tau2 mau dilepaskan kyk apa jadinya rumah kita;['number', 'lebih', 'narapidana', 'bebas', 'di', 'tengah', 'wabah', 'covid', 'number', 'termasuk', 'koruptor', 'kebayang', 'ga', 'sih', 'klo', 'kita', 'sudah', 'susah', 'payah', 'menangkap', 'tikus', 'sampai', 'dapat', 'banyak', 'bgt', 'itupun', 'blm', 'semuanya', 'eh', 'elongated', 'repeated', 'tau2', 'mau', 'dilepaskan', 'kyk', 'apa', 'jadinya', 'rumah', 'kita'];['number', 'lebih', 'narapidana', 'bebas', 'di', 'tengah', 'wabah', 'covid', 'number', 'termasuk', 'koruptor', 'kebayang', 'tidak', 'sih', 'kalau', 'kita', 'sudah', 'susah', 'payah', 'menangkap', 'tikus', 'sampai', 'dapat', 'banyak', 'banget', 'itupun', 'belum', 'semuanya', 'eh', 'elongated', 'repeated', 'tau2', 'mau', 'dilepaskan', 'kayak', 'apa', 'jadinya', 'rumah', 'kita'];['number', 'narapidana', 'bebas', 'wabah', 'covid', 'number', 'koruptor', 'kebayang', 'sih', 'susah', 'payah', 'menangkap', 'tikus', 'banget', 'itupun', 'eh', 'elongated', 'repeated', 'tau2', 'dilepaskan', 'kayak', 'rumah'];number narapidana bebas wabah covid number koruptor kebayang sih susah payah menangkap tikus banget itupun eh elongated repeated tau2 dilepaskan kayak rumah;number narapidana bebas wabah covid number koruptor bayang sih susah payah tangkap tikus banget itu eh elongated repeated tau2 lepas kayak rumah
239;PHYSICAL DISTANCING MEMUTUS RANTAI PENYEBARAN COVID-19;1.0;allcaps physical distancing memutus rantai penyebaran covid allcaps number;['allcaps', 'physical', 'distancing', 'memutus', 'rantai', 'penyebaran', 'covid', 'allcaps', 'number'];['allcaps', 'physical', 'distancing', 'memutus', 'rantai', 'penyebaran', 'covid', 'allcaps', 'number'];['allcaps', 'physical', 'distancing', 'memutus', 'rantai', 'penyebaran', 'covid', 'allcaps', 'number'];allcaps physical distancing memutus rantai penyebaran covid allcaps number;allcaps physical distancing putus rantai sebar covid allcaps number
240;Seram: Jatuh Tempo Massal Covid-19 di USA, Bagaimana dengan Indonesia? -;0.0;seram jatuh tempo massal covid number di allcaps usa allcaps bagaimana dengan indonesia;['seram', 'jatuh', 'tempo', 'massal', 'covid', 'number', 'di', 'allcaps', 'usa', 'allcaps', 'bagaimana', 'dengan', 'indonesia'];['seram', 'jatuh', 'tempo', 'massal', 'covid', 'number', 'di', 'allcaps', 'usa', 'allcaps', 'bagaimana', 'dengan', 'indonesia'];['seram', 'jatuh', 'tempo', 'massal', 'covid', 'number', 'allcaps', 'usa', 'allcaps', 'indonesia'];seram jatuh tempo massal covid number allcaps usa allcaps indonesia;seram jatuh tempo massal covid number allcaps usa allcaps indonesia
241;Repotnya Sissy Priscillia Dampingi Anak Sekolah sambil Bekerja dari Rumah Selama Wabah Covid-19;0.0;repotnya sissy priscillia dampingi anak sekolah sambil bekerja dari rumah selama wabah covid number;['repotnya', 'sissy', 'priscillia', 'dampingi', 'anak', 'sekolah', 'sambil', 'bekerja', 'dari', 'rumah', 'selama', 'wabah', 'covid', 'number'];['repotnya', 'sissy', 'priscillia', 'dampingi', 'anak', 'sekolah', 'sambil', 'bekerja', 'dari', 'rumah', 'selama', 'wabah', 'covid', 'number'];['repotnya', 'sissy', 'priscillia', 'dampingi', 'anak', 'sekolah', 'rumah', 'wabah', 'covid', 'number'];repotnya sissy priscillia dampingi anak sekolah rumah wabah covid number;repot sissy priscillia damping anak sekolah rumah wabah covid number
242;Tak Kenal Lelah, Tim Gugus Tugas Covid 19 Kembali Semprot Pemukiman Padat Penduduk di Belawan;1.0;tak kenal lelah tim gugus tugas covid number kembali semprot pemukiman padat penduduk di belawan;['tak', 'kenal', 'lelah', 'tim', 'gugus', 'tugas', 'covid', 'number', 'kembali', 'semprot', 'pemukiman', 'padat', 'penduduk', 'di', 'belawan'];['tak', 'kenal', 'lelah', 'tim', 'gugus', 'tugas', 'covid', 'number', 'kembali', 'semprot', 'pemukiman', 'padat', 'penduduk', 'di', 'belawan'];['kenal', 'lelah', 'tim', 'gugus', 'tugas', 'covid', 'number', 'semprot', 'pemukiman', 'padat', 'penduduk', 'belawan'];kenal lelah tim gugus tugas covid number semprot pemukiman padat penduduk belawan;kenal lelah tim gugus tugas covid number semprot mukim padat duduk belawan
243;Begitu ntar bnyak yg kena covid si miskin yg dituduh bawa virus ya nasib jadi org miskin ky gw kuli proyek,sopir ambulans dan kang gali kubur bakal kena getahnya lindungi kami kaum Miskin ya Rabb..;1.0;begitu ntar bnyak yg kena covid si miskin yg dituduh bawa virus ya nasib jadi org miskin ky gw kuli proyek sopir ambulans dan kang gali kubur bakal kena getahnya lindungi kami kaum miskin ya rabb repeated;['begitu', 'ntar', 'bnyak', 'yg', 'kena', 'covid', 'si', 'miskin', 'yg', 'dituduh', 'bawa', 'virus', 'ya', 'nasib', 'jadi', 'org', 'miskin', 'ky', 'gw', 'kuli', 'proyek', 'sopir', 'ambulans', 'dan', 'kang', 'gali', 'kubur', 'bakal', 'kena', 'getahnya', 'lindungi', 'kami', 'kaum', 'miskin', 'ya', 'rabb', 'repeated'];['begitu', 'nanti', 'bnyak', 'yang', 'kena', 'covid', 'sih', 'miskin', 'yang', 'dituduh', 'bawa', 'virus', 'iya', 'nasib', 'jadi', 'orang', 'miskin', 'ky', 'saya', 'kuli', 'proyek', 'sopir', 'ambulans', 'dan', 'kang', 'gali', 'kubur', 'bakal', 'kena', 'getahnya', 'lindungi', 'kami', 'kaum', 'miskin', 'iya', 'rabb', 'repeated'];['bnyak', 'kena', 'covid', 'sih', 'miskin', 'dituduh', 'bawa', 'virus', 'iya', 'nasib', 'orang', 'miskin', 'ky', 'kuli', 'proyek', 'sopir', 'ambulans', 'kang', 'gali', 'kubur', 'kena', 'getahnya', 'lindungi', 'kaum', 'miskin', 'iya', 'rabb', 'repeated'];bnyak kena covid sih miskin dituduh bawa virus iya nasib orang miskin ky kuli proyek sopir ambulans kang gali kubur kena getahnya lindungi kaum miskin iya rabb repeated;bnyak kena covid sih miskin tuduh bawa virus iya nasib orang miskin ky kuli proyek sopir ambulans kang gali kubur kena getah lindung kaum miskin iya rabb repeated
244;Berapa banyak bahan kempen dia mahu padam da... Daripada release, padam... release, padam macam ni... lebih baik dok dendiam wat keje yg org tk nampak, takyah wat kempen langsung. Save wang kerajaan, boleh masuk tabung Covid-19 tolong rakyat.;0.0;berapa banyak bahan kempen dia mahu padam da repeated daripada release padam repeated release padam macam ni repeated lebih baik dok dendiam wat keje yg org tk nampak takyah wat kempen langsung save wang kerajaan boleh masuk tabung covid number tolong rakyat;['berapa', 'banyak', 'bahan', 'kempen', 'dia', 'mahu', 'padam', 'da', 'repeated', 'daripada', 'release', 'padam', 'repeated', 'release', 'padam', 'macam', 'ni', 'repeated', 'lebih', 'baik', 'dok', 'dendiam', 'wat', 'keje', 'yg', 'org', 'tk', 'nampak', 'takyah', 'wat', 'kempen', 'langsung', 'save', 'wang', 'kerajaan', 'boleh', 'masuk', 'tabung', 'covid', 'number', 'tolong', 'rakyat'];['berapa', 'banyak', 'bahan', 'kempen', 'dia', 'mahu', 'padam', 'da', 'repeated', 'daripada', 'release', 'padam', 'repeated', 'release', 'padam', 'macam', 'ini', 'repeated', 'lebih', 'baik', 'dok', 'dendiam', 'wat', 'keje', 'yang', 'orang', 'tingkat', 'nampak', 'takyah', 'wat', 'kempen', 'langsung', 'save', 'wang', 'kerajaan', 'boleh', 'masuk', 'tabung', 'covid', 'number', 'tolong', 'rakyat'];['bahan', 'kempen', 'mahu', 'padam', 'da', 'repeated', 'release', 'padam', 'repeated', 'release', 'padam', 'repeated', 'dok', 'dendiam', 'wat', 'keje', 'orang', 'tingkat', 'nampak', 'takyah', 'wat', 'kempen', 'langsung', 'save', 'wang', 'kerajaan', 'masuk', 'tabung', 'covid', 'number', 'tolong', 'rakyat'];bahan kempen mahu padam da repeated release padam repeated release padam repeated dok dendiam wat keje orang tingkat nampak takyah wat kempen langsung save wang kerajaan masuk tabung covid number tolong rakyat;bahan kempen mahu padam da repeated release padam repeated release padam repeated dok dendiam wat keje orang tingkat nampak takyah wat kempen langsung save wang raja masuk tabung covid number tolong rakyat
245;PANDUAN ISOLASI MANDIRI ANTISIPASI PENYEBARAN COVID-19;1.0;allcaps panduan isolasi mandiri antisipasi penyebaran covid allcaps number;['allcaps', 'panduan', 'isolasi', 'mandiri', 'antisipasi', 'penyebaran', 'covid', 'allcaps', 'number'];['allcaps', 'panduan', 'isolasi', 'mandiri', 'antisipasi', 'penyebaran', 'covid', 'allcaps', 'number'];['allcaps', 'panduan', 'isolasi', 'mandiri', 'antisipasi', 'penyebaran', 'covid', 'allcaps', 'number'];allcaps panduan isolasi mandiri antisipasi penyebaran covid allcaps number;allcaps pandu isolasi mandiri antisipasi sebar covid allcaps number
246;Betoi tu.zmn PKP ni kita spatut bantu nambah beban pulak...sb spesis ni la yg angkuh bodoh ni bertambah kes covid ni..;0.0;betoi tu zmn allcaps pkp allcaps ni kita spatut bantu nambah beban pulak repeated sb spesis ni la yg angkuh bodoh ni bertambah kes covid ni repeated;['betoi', 'tu', 'zmn', 'allcaps', 'pkp', 'allcaps', 'ni', 'kita', 'spatut', 'bantu', 'nambah', 'beban', 'pulak', 'repeated', 'sb', 'spesis', 'ni', 'la', 'yg', 'angkuh', 'bodoh', 'ni', 'bertambah', 'kes', 'covid', 'ni', 'repeated'];['betoi', 'itu', 'zmn', 'allcaps', 'pkp', 'allcaps', 'ini', 'kita', 'spatut', 'bantu', 'nambah', 'beban', 'pulak', 'repeated', 'sb', 'spesis', 'ini', 'la', 'yang', 'angkuh', 'bodoh', 'ini', 'bertambah', 'kes', 'covid', 'ini', 'repeated'];['betoi', 'zmn', 'allcaps', 'pkp', 'allcaps', 'spatut', 'bantu', 'nambah', 'beban', 'pulak', 'repeated', 'sb', 'spesis', 'la', 'angkuh', 'bodoh', 'bertambah', 'kes', 'covid', 'repeated'];betoi zmn allcaps pkp allcaps spatut bantu nambah beban pulak repeated sb spesis la angkuh bodoh bertambah kes covid repeated;betoi zmn allcaps pkp allcaps spatut bantu nambah beban pulak repeated sb spesis la angkuh bodoh tambah kes covid repeated
247;Nih aku kasih Tips Cegah penyebaran Berita Hoax Covid-19 di WA.teliti dulu beritanya ya kak..Jangan asal teruskan..;1.0;nih aku kasih tips cegah penyebaran berita hoax covid number di wa teliti dulu beritanya ya kak repeated jangan asal teruskan repeated;['nih', 'aku', 'kasih', 'tips', 'cegah', 'penyebaran', 'berita', 'hoax', 'covid', 'number', 'di', 'wa', 'teliti', 'dulu', 'beritanya', 'ya', 'kak', 'repeated', 'jangan', 'asal', 'teruskan', 'repeated'];['ini', 'aku', 'kasih', 'tips', 'cegah', 'penyebaran', 'berita', 'bohong', 'covid', 'number', 'di', 'wa', 'teliti', 'dulu', 'beritanya', 'iya', 'kak', 'repeated', 'jangan', 'asal', 'teruskan', 'repeated'];['kasih', 'tips', 'cegah', 'penyebaran', 'berita', 'bohong', 'covid', 'number', 'wa', 'teliti', 'beritanya', 'iya', 'kak', 'repeated', 'teruskan', 'repeated'];kasih tips cegah penyebaran berita bohong covid number wa teliti beritanya iya kak repeated teruskan repeated;kasih tips cegah sebar berita bohong covid number wa teliti berita iya kak repeated terus repeated
248;Surabaya  Babinsa Koramil Tenggilis mejoyo terus berupaya melaksanakan sosialisasi kepada warga masyarakatnya untuk meredam mewabahnya virus corona atau Covid 19.Kali ini Serma Siswono dan Sertu Supri Warsoyo;1.0;surabaya babinsa koramil tenggilis mejoyo terus berupaya melaksanakan sosialisasi kepada warga masyarakatnya untuk meredam mewabahnya virus corona atau covid number kali ini serma siswono dan sertu supri warsoyo;['surabaya', 'babinsa', 'koramil', 'tenggilis', 'mejoyo', 'terus', 'berupaya', 'melaksanakan', 'sosialisasi', 'kepada', 'warga', 'masyarakatnya', 'untuk', 'meredam', 'mewabahnya', 'virus', 'corona', 'atau', 'covid', 'number', 'kali', 'ini', 'serma', 'siswono', 'dan', 'sertu', 'supri', 'warsoyo'];['surabaya', 'babinsa', 'koramil', 'tenggilis', 'mejoyo', 'terus', 'berupaya', 'melaksanakan', 'sosialisasi', 'kepada', 'warga', 'masyarakatnya', 'untuk', 'meredam', 'mewabahnya', 'virus', 'corona', 'atau', 'covid', 'number', 'kali', 'ini', 'serma', 'siswono', 'dan', 'sertu', 'supri', 'warsoyo'];['surabaya', 'babinsa', 'koramil', 'tenggilis', 'mejoyo', 'berupaya', 'melaksanakan', 'sosialisasi', 'warga', 'masyarakatnya', 'meredam', 'mewabahnya', 'virus', 'corona', 'covid', 'number', 'kali', 'serma', 'siswono', 'sertu', 'supri', 'warsoyo'];surabaya babinsa koramil tenggilis mejoyo berupaya melaksanakan sosialisasi warga masyarakatnya meredam mewabahnya virus corona covid number kali serma siswono sertu supri warsoyo;surabaya babinsa koramil tenggilis mejoyo upaya laksana sosialisasi warga masyarakat redam wabah virus corona covid number kali serma siswono sertu supri warsoyo
249;Virus corona tak mengenal usia, pangkat maupun jabatan. Mereka yang berada di keluarga kerajaan Saudi pun tertular Covid-19.;1.0;virus corona tak mengenal usia pangkat maupun jabatan mereka yang berada di keluarga kerajaan saudi pun tertular covid number;['virus', 'corona', 'tak', 'mengenal', 'usia', 'pangkat', 'maupun', 'jabatan', 'mereka', 'yang', 'berada', 'di', 'keluarga', 'kerajaan', 'saudi', 'pun', 'tertular', 'covid', 'number'];['virus', 'corona', 'tak', 'mengenal', 'usia', 'pangkat', 'maupun', 'jabatan', 'mereka', 'yang', 'berada', 'di', 'keluarga', 'kerajaan', 'saudi', 'pun', 'tertular', 'covid', 'number'];['virus', 'corona', 'mengenal', 'usia', 'pangkat', 'jabatan', 'keluarga', 'kerajaan', 'saudi', 'tertular', 'covid', 'number'];virus corona mengenal usia pangkat jabatan keluarga kerajaan saudi tertular covid number;virus corona kenal usia pangkat jabat keluarga raja saudi tular covid number
250;Asalamualaikum selamat pagi semua semogga hari ini lebih baik Dr hati2 sebelumnya semogga covid-19 cepat berlalu dan sebelum masuk bulan rohomadhon semgga tidak ada covid-19 lagi amin ya robal alamin.;1.0;asalamualaikum selamat pagi semua semogga hari ini lebih baik dr hati2 sebelumnya semogga covid number cepat berlalu dan sebelum masuk bulan rohomadhon semgga tidak ada covid number lagi amin ya robal alamin;['asalamualaikum', 'selamat', 'pagi', 'semua', 'semogga', 'hari', 'ini', 'lebih', 'baik', 'dr', 'hati2', 'sebelumnya', 'semogga', 'covid', 'number', 'cepat', 'berlalu', 'dan', 'sebelum', 'masuk', 'bulan', 'rohomadhon', 'semgga', 'tidak', 'ada', 'covid', 'number', 'lagi', 'amin', 'ya', 'robal', 'alamin'];['asalamualaikum', 'selamat', 'pagi', 'semua', 'semogga', 'hari', 'ini', 'lebih', 'baik', 'dari', 'hati2', 'sebelumnya', 'semogga', 'covid', 'number', 'cepat', 'berlalu', 'dan', 'sebelum', 'masuk', 'bulan', 'rohomadhon', 'semgga', 'tidak', 'ada', 'covid', 'number', 'lagi', 'semoga', 'iya', 'robal', 'alamin'];['asalamualaikum', 'selamat', 'pagi', 'semogga', 'hati2', 'semogga', 'covid', 'number', 'cepat', 'masuk', 'rohomadhon', 'semgga', 'covid', 'number', 'semoga', 'iya', 'robal', 'alamin'];asalamualaikum selamat pagi semogga hati2 semogga covid number cepat masuk rohomadhon semgga covid number semoga iya robal alamin;asalamualaikum selamat pagi semogga hati2 semogga covid number cepat masuk rohomadhon semgga covid number moga iya robal alamin
251;Mudah2an semua Covid p badan mu.;-1.0;mudah2an semua covid badan mu;['mudah2an', 'semua', 'covid', 'badan', 'mu'];['mudah2an', 'semua', 'covid', 'badan', 'mu'];['mudah2an', 'covid', 'badan', 'mu'];mudah2an covid badan mu;mudah2an covid badan mu
252;"Mimpi semalam; PSBB bertahan hanya beberapa hari. Dibatalkan karena kasus covid datanya dibuat tampak sudah tidak bertambah. Tekanan berbagai pihak membuat pemerintah segera menjalankan kegiatan perekonomian seperti sedia kala. Ahli kesehatan dan tenaga medis hanya bisa pasrah";0.0;mimpi semalam allcaps psbb allcaps bertahan hanya beberapa hari dibatalkan karena kasus covid datanya dibuat tampak sudah tidak bertambah tekanan berbagai pihak membuat pemerintah segera menjalankan kegiatan perekonomian seperti sedia kala ahli kesehatan dan tenaga medis hanya bisa pasrah;['mimpi', 'semalam', 'allcaps', 'psbb', 'allcaps', 'bertahan', 'hanya', 'beberapa', 'hari', 'dibatalkan', 'karena', 'kasus', 'covid', 'datanya', 'dibuat', 'tampak', 'sudah', 'tidak', 'bertambah', 'tekanan', 'berbagai', 'pihak', 'membuat', 'pemerintah', 'segera', 'menjalankan', 'kegiatan', 'perekonomian', 'seperti', 'sedia', 'kala', 'ahli', 'kesehatan', 'dan', 'tenaga', 'medis', 'hanya', 'bisa', 'pasrah'];['mimpi', 'semalam', 'allcaps', 'psbb', 'allcaps', 'bertahan', 'hanya', 'beberapa', 'hari', 'dibatalkan', 'karena', 'kasus', 'covid', 'datanya', 'dibuat', 'tampak', 'sudah', 'tidak', 'bertambah', 'tekanan', 'berbagai', 'pihak', 'membuat', 'pemerintah', 'segera', 'menjalankan', 'kegiatan', 'perekonomian', 'seperti', 'sedia', 'kala', 'ahli', 'kesehatan', 'dan', 'tenaga', 'medis', 'hanya', 'bisa', 'pasrah'];['mimpi', 'semalam', 'allcaps', 'psbb', 'allcaps', 'bertahan', 'dibatalkan', 'covid', 'datanya', 'bertambah', 'tekanan', 'pemerintah', 'menjalankan', 'kegiatan', 'perekonomian', 'sedia', 'ahli', 'kesehatan', 'tenaga', 'medis', 'pasrah'];mimpi semalam allcaps psbb allcaps bertahan dibatalkan covid datanya bertambah tekanan pemerintah menjalankan kegiatan perekonomian sedia ahli kesehatan tenaga medis pasrah;mimpi malam allcaps psbb allcaps tahan batal covid data tambah tekan perintah jalan giat ekonomi sedia ahli sehat tenaga medis pasrah
253;1. Dampak Covid-19 terhadap Perekonomian Indonesia Jawab : kondisi sekarang ini akan berimbas pada menurunnya konsumsi rumah tangga,Lebih dari itu, investasi pun akan merosot tajam. Maka COVID-19, diprediksi investasi akan merosot ke level satu persen atau terburuk.;1.0;number dampak covid number terhadap perekonomian indonesia jawab kondisi sekarang ini akan berimbas pada menurunnya konsumsi rumah tangga lebih dari itu investasi pun akan merosot tajam maka allcaps covid allcaps number diprediksi investasi akan merosot ke level satu persen atau terburuk;['number', 'dampak', 'covid', 'number', 'terhadap', 'perekonomian', 'indonesia', 'jawab', 'kondisi', 'sekarang', 'ini', 'akan', 'berimbas', 'pada', 'menurunnya', 'konsumsi', 'rumah', 'tangga', 'lebih', 'dari', 'itu', 'investasi', 'pun', 'akan', 'merosot', 'tajam', 'maka', 'allcaps', 'covid', 'allcaps', 'number', 'diprediksi', 'investasi', 'akan', 'merosot', 'ke', 'level', 'satu', 'persen', 'atau', 'terburuk'];['number', 'dampak', 'covid', 'number', 'terhadap', 'perekonomian', 'indonesia', 'jawab', 'kondisi', 'sekarang', 'ini', 'akan', 'berimbas', 'pada', 'menurunnya', 'konsumsi', 'rumah', 'tangga', 'lebih', 'dari', 'itu', 'investasi', 'pun', 'akan', 'merosot', 'tajam', 'maka', 'allcaps', 'covid', 'allcaps', 'number', 'diprediksi', 'investasi', 'akan', 'merosot', 'ke', 'level', 'satu', 'persen', 'atau', 'terburuk'];['number', 'dampak', 'covid', 'number', 'perekonomian', 'indonesia', 'kondisi', 'berimbas', 'menurunnya', 'konsumsi', 'rumah', 'tangga', 'investasi', 'merosot', 'tajam', 'allcaps', 'covid', 'allcaps', 'number', 'diprediksi', 'investasi', 'merosot', 'level', 'persen', 'terburuk'];number dampak covid number perekonomian indonesia kondisi berimbas menurunnya konsumsi rumah tangga investasi merosot tajam allcaps covid allcaps number diprediksi investasi merosot level persen terburuk;number dampak covid number ekonomi indonesia kondisi imbas turun konsumsi rumah tangga investasi merosot tajam allcaps covid allcaps number prediksi investasi merosot level persen buruk
254;Cegah Covid 19, di Area Physical Distancing;1.0;cegah covid number di area physical distancing;['cegah', 'covid', 'number', 'di', 'area', 'physical', 'distancing'];['cegah', 'covid', 'number', 'di', 'area', 'physical', 'distancing'];['cegah', 'covid', 'number', 'area', 'physical', 'distancing'];cegah covid number area physical distancing;cegah covid number area physical distancing
255;kalo perusahaan baru yang mau bikin eFin bagaimana min? Secara lagi ada wabah covid-19 ini, apa ke kantor pajak setempat atau secara online min? Trmksh;0.0;kalo perusahaan baru yang mau bikin efin bagaimana min secara lagi ada wabah covid number ini apa ke kantor pajak setempat atau secara online min trmksh;['kalo', 'perusahaan', 'baru', 'yang', 'mau', 'bikin', 'efin', 'bagaimana', 'min', 'secara', 'lagi', 'ada', 'wabah', 'covid', 'number', 'ini', 'apa', 'ke', 'kantor', 'pajak', 'setempat', 'atau', 'secara', 'online', 'min', 'trmksh'];['kalau', 'perusahaan', 'baru', 'yang', 'mau', 'membuat', 'efin', 'bagaimana', 'min', 'secara', 'lagi', 'ada', 'wabah', 'covid', 'number', 'ini', 'apa', 'ke', 'kantor', 'pajak', 'setempat', 'atau', 'secara', 'online', 'min', 'trmksh'];['perusahaan', 'efin', 'min', 'wabah', 'covid', 'number', 'kantor', 'pajak', 'online', 'min', 'trmksh'];perusahaan efin min wabah covid number kantor pajak online min trmksh;usaha efin min wabah covid number kantor pajak online min trmksh
256;Peta identifikasi sebaran covid-19 di Kota Serang update per hari ini. Berdasarkan postingan dinkeskotaserang pasien positif di Kota Serang bertambah sehingga total menjadi 2 orang.Hal-hal terkait pertanyaan;1.0;peta identifikasi sebaran covid number di kota serang update per hari ini berdasarkan postingan dinkeskotaserang pasien positif di kota serang bertambah sehingga total menjadi number orang hal hal terkait pertanyaan;['peta', 'identifikasi', 'sebaran', 'covid', 'number', 'di', 'kota', 'serang', 'update', 'per', 'hari', 'ini', 'berdasarkan', 'postingan', 'dinkeskotaserang', 'pasien', 'positif', 'di', 'kota', 'serang', 'bertambah', 'sehingga', 'total', 'menjadi', 'number', 'orang', 'hal', 'hal', 'terkait', 'pertanyaan'];['peta', 'identifikasi', 'sebaran', 'covid', 'number', 'di', 'kota', 'serang', 'update', 'per', 'hari', 'ini', 'berdasarkan', 'postingan', 'dinkeskotaserang', 'pasien', 'positif', 'di', 'kota', 'serang', 'bertambah', 'sehingga', 'total', 'menjadi', 'number', 'orang', 'hal', 'hal', 'terkait', 'pertanyaan'];['peta', 'identifikasi', 'sebaran', 'covid', 'number', 'kota', 'serang', 'update', 'berdasarkan', 'postingan', 'dinkeskotaserang', 'pasien', 'positif', 'kota', 'serang', 'bertambah', 'total', 'number', 'orang', 'terkait'];peta identifikasi sebaran covid number kota serang update berdasarkan postingan dinkeskotaserang pasien positif kota serang bertambah total number orang terkait;peta identifikasi sebar covid number kota serang update dasar postingan dinkeskotaserang pasien positif kota serang tambah total number orang kait
257;semenjak covid ni.....ramai ke pompuan yg gigih pakai make up keluar rumah...dengan mask lagi?;0.0;semenjak covid ni repeated ramai ke pompuan yg gigih pakai make up keluar rumah repeated dengan mask lagi;['semenjak', 'covid', 'ni', 'repeated', 'ramai', 'ke', 'pompuan', 'yg', 'gigih', 'pakai', 'make', 'up', 'keluar', 'rumah', 'repeated', 'dengan', 'mask', 'lagi'];['semenjak', 'covid', 'ini', 'repeated', 'ramai', 'ke', 'pompuan', 'yang', 'gigih', 'pakai', 'make', 'up', 'keluar', 'rumah', 'repeated', 'dengan', 'mask', 'lagi'];['semenjak', 'covid', 'repeated', 'ramai', 'pompuan', 'gigih', 'pakai', 'make', 'up', 'rumah', 'repeated', 'mask'];semenjak covid repeated ramai pompuan gigih pakai make up rumah repeated mask;semenjak covid repeated ramai pompuan gigih pakai make up rumah repeated mask
258;Klo sy lebih berduka dgn meninggalnya para petugas medis yg berjibaku mengamankan pasien dari covid 19.;1.0;klo sy lebih berduka dgn meninggalnya para petugas medis yg berjibaku mengamankan pasien dari covid number;['klo', 'sy', 'lebih', 'berduka', 'dgn', 'meninggalnya', 'para', 'petugas', 'medis', 'yg', 'berjibaku', 'mengamankan', 'pasien', 'dari', 'covid', 'number'];['kalau', 'saya', 'lebih', 'berduka', 'dengan', 'meninggalnya', 'para', 'petugas', 'medis', 'yang', 'berjibaku', 'mengamankan', 'pasien', 'dari', 'covid', 'number'];['berduka', 'meninggalnya', 'petugas', 'medis', 'berjibaku', 'mengamankan', 'pasien', 'covid', 'number'];berduka meninggalnya petugas medis berjibaku mengamankan pasien covid number;duka tinggal tugas medis jibaku aman pasien covid number
